{
  "$schema": "https://json-schema.org/draft/2020-12/schema",
  "$id": "https://resonateengine.dev/schema/resonate.module.schema.json",
  "title": "ResonateEngine module manifest",
  "description": "One per module, written as resonate.module.json beside its sources. This schema covers the shape of the file; the cross-file invariants (ids unique, every requirement provided, descriptor and build table agreeing) are enforced by scripts/module_check.lua on every build.",
  "type": "object",
  "required": ["id", "name", "version", "abi", "min_host_abi", "summary", "provides", "requires", "optional", "depends_on"],
  "additionalProperties": false,
  "properties": {
    "id": {
      "description": "Reverse-DNS identity. Unique across modules and used by the dependency graph; never shown to a user.",
      "type": "string",
      "pattern": "^resonate(\\.[a-z][a-z0-9_]*)+$"
    },
    "name": {
      "description": "Display name for logs and editor lists. Carries no identity, and two modules may share one.",
      "type": "string",
      "minLength": 1
    },
    "version": {
      "description": "Semantic version of the module itself, not of the ABI.",
      "type": "string",
      "pattern": "^[0-9]+\\.[0-9]+\\.[0-9]+(-[0-9A-Za-z.-]+)?(\\+[0-9A-Za-z.-]+)?$"
    },
    "abi": {
      "description": "Major ABI version the module was built against.",
      "type": "integer",
      "minimum": 1
    },
    "min_host_abi": {
      "description": "Lowest host major ABI this module accepts.",
      "type": "integer",
      "minimum": 1
    },
    "summary": {
      "description": "One line describing what the module is for.",
      "type": "string",
      "minLength": 1
    },
    "provides": {
      "description": "Capabilities this module publishes. Each one belongs to exactly one module.",
      "type": "array",
      "items": {
        "$ref": "#/$defs/capabilityId"
      },
      "uniqueItems": true
    },
    "requires": {
      "description": "Capabilities the host must resolve before on_attach runs.",
      "type": "array",
      "items": {
        "$ref": "#/$defs/capabilityId"
      },
      "uniqueItems": true
    },
    "optional": {
      "description": "Capabilities that may be absent. The consumer checks the handle it gets back.",
      "type": "array",
      "items": {
        "$ref": "#/$defs/capabilityId"
      },
      "uniqueItems": true
    },
    "depends_on": {
      "description": "Modules that must be attached first, independent of capabilities.",
      "type": "array",
      "items": {
        "$ref": "#/$defs/moduleId"
      },
      "uniqueItems": true
    }
  },
  "$defs": {
    "capabilityId": {
      "description": "Capability name, as it appears in CapabilityTraits<T>::id. Hashed to a 128-bit ResonateId, so renaming one is an ABI break.",
      "type": "string",
      "pattern": "^Resonate(\\.[A-Za-z][A-Za-z0-9]*)+$"
    },
    "moduleId": {
      "description": "Reverse-DNS module id.",
      "type": "string",
      "pattern": "^resonate(\\.[a-z][a-z0-9_]*)+$"
    }
  }
}
